<?xml version="1.0" encoding="utf-8"?>
<global_rules xmlns:xsi="http://www.w3.org/2001/XMLSchema-instance" xsi:noNamespaceSchemaLocation="../../global_rules.xsd">
	<!-- Multiple Monster Drops -->
	<gd_rule rule_name="Named Key" chance="100">
		<gd_maps>
			<gd_map map_id="301240000" /><!-- Legion_Kysis_Barracks -->
			<gd_map map_id="301280000" /><!-- Kysis_Barracks -->
		</gd_maps>
		<gd_npcs>
			<gd_npc npc_id="233670" /><!-- Treasurer Darmaraja -->
			<gd_npc npc_id="233671" /><!-- Treasurer Swaraja -->
			<gd_npc npc_id="233672" /><!-- Treasurer Chandra -->
			<gd_npc npc_id="233673" /><!-- Treasurer Dragagh -->
		</gd_npcs>
		<gd_items>
			<gd_item id="185000061" /><!-- Kysis Armory Key -->
			<gd_item id="185000062" /><!-- Kysis Supply Base Key -->
			<gd_item id="185000063" /><!-- Kysis Operations Room Key -->
		</gd_items>
	</gd_rule>
	<!-- Single Monster Drops -->
	<gd_rule rule_name="Named Mark" chance="100" member_limit="6">
		<gd_maps>
			<gd_map map_id="301240000" /><!-- Legion_Kysis_Barracks -->
			<gd_map map_id="301280000" /><!-- Kysis_Barracks -->
		</gd_maps>
		<gd_npcs>
			<gd_npc npc_id="233675" /><!-- Weakened Kysis Duke -->
			<gd_npc npc_id="233676" /><!-- Enraged Kysis Duke -->
		</gd_npcs>
		<gd_items>
			<gd_item id="186000238" min_count="60" max_count="90" /><!-- Conqueror's Mark -->
		</gd_items>
	</gd_rule>
	<gd_rule rule_name="Named Treasure Key" chance="100">
		<gd_maps>
			<gd_map map_id="301240000" /><!-- Legion_Kysis_Barracks -->
			<gd_map map_id="301280000" /><!-- Kysis_Barracks -->
		</gd_maps>
		<gd_npcs>
			<gd_npc npc_id="233675" /><!-- Weakened Kysis Duke -->
			<gd_npc npc_id="233676" /><!-- Enraged Kysis Duke -->
		</gd_npcs>
		<gd_items>
			<gd_item id="185000064" /><!-- Kysis Treasure Room Key -->
		</gd_items>
	</gd_rule>
	<gd_rule rule_name="Named Gold Key" chance="100">
		<gd_maps>
			<gd_map map_id="301240000" /><!-- Legion_Kysis_Barracks -->
			<gd_map map_id="301280000" /><!-- Kysis_Barracks -->
		</gd_maps>
		<gd_npcs>
			<gd_npc npc_id="233675" /><!-- Weakened Kysis Duke -->
			<gd_npc npc_id="233676" /><!-- Enraged Kysis Duke -->
		</gd_npcs>
		<gd_items>
			<gd_item id="185000065" /><!-- Kysis Gold Room Key -->
		</gd_items>
	</gd_rule>
</global_rules>