<?xml version="1.0" encoding="utf-8"?>
<global_rules xmlns:xsi="http://www.w3.org/2001/XMLSchema-instance" xsi:noNamespaceSchemaLocation="../../global_rules.xsd">
	<!-- Multiple Monster Drops -->
	<gd_rule rule_name="Named Mount" chance="20">
		<gd_maps>
			<gd_map map_id="700010000"/><!-- Oriel -->
		</gd_maps>
		<gd_npcs>
			<gd_npc npc_id="218850"/><!-- Spring Agrint -->
			<gd_npc npc_id="218851"/><!-- Summer Agrint -->
			<gd_npc npc_id="218852"/><!-- Autumn Agrint -->
			<gd_npc npc_id="218853"/><!-- Winter Agrint -->
		</gd_npcs>
		<gd_items>
			<gd_item id="190100012"/><!-- Waveform Surfrider -->
		</gd_items>
	</gd_rule>
	<gd_rule rule_name="Named Bundle" chance="100">
		<gd_maps>
			<gd_map map_id="700010000"/><!-- Oriel -->
		</gd_maps>
		<gd_npcs>
			<gd_npc npc_id="218850"/><!-- Spring Agrint -->
			<gd_npc npc_id="218851"/><!-- Summer Agrint -->
			<gd_npc npc_id="218852"/><!-- Autumn Agrint -->
			<gd_npc npc_id="218853"/><!-- Winter Agrint -->
		</gd_npcs>
		<gd_items>
			<gd_item id="188051564" max_count="2"/><!-- Housing Accessory Bundle -->
		</gd_items>
	</gd_rule>
	<gd_rule rule_name="Named Season Light" chance="100" member_limit="6">
		<gd_maps>
			<gd_map map_id="700010000"/><!-- Oriel -->
		</gd_maps>
		<gd_npcs>
			<gd_npc npc_id="218850"/><!-- Spring Agrint -->
			<gd_npc npc_id="218851"/><!-- Summer Agrint -->
			<gd_npc npc_id="218852"/><!-- Autumn Agrint -->
			<gd_npc npc_id="218853"/><!-- Winter Agrint -->
		</gd_npcs>
		<gd_items>
			<gd_item id="182006984"/><!-- Season's Light -->
		</gd_items>
	</gd_rule>
	<gd_rule rule_name="Named Aether Gem" chance="80">
		<gd_maps>
			<gd_map map_id="700010000"/><!-- Oriel -->
		</gd_maps>
		<gd_npcs>
			<gd_npc npc_id="218854"/><!-- Vernal Audria -->
			<gd_npc npc_id="218855"/><!-- Sprouting Audria -->
			<gd_npc npc_id="218856"/><!-- Sweltering Audria -->
			<gd_npc npc_id="218857"/><!-- Rain Audria -->
			<gd_npc npc_id="218858"/><!-- Foliage Audria -->
			<gd_npc npc_id="218859"/><!-- Sunset Audria -->
			<gd_npc npc_id="218860"/><!-- Ice Audria -->
			<gd_npc npc_id="218861"/><!-- Snowflower Audria -->
		</gd_npcs>
		<gd_items>
			<gd_item id="182006851"/><!-- Broken Aether Gem -->
			<gd_item id="182006852"/><!-- Rough Aether Gem -->
			<gd_item id="182006853"/><!-- Hard Aether Gem -->
		</gd_items>
	</gd_rule>
	<gd_rule rule_name="Named Fertile Soil" chance="100">
		<gd_maps>
			<gd_map map_id="700010000"/><!-- Oriel -->
		</gd_maps>
		<gd_npcs>
			<gd_npc npc_id="218854"/><!-- Vernal Audria -->
			<gd_npc npc_id="218855"/><!-- Sprouting Audria -->
			<gd_npc npc_id="218856"/><!-- Sweltering Audria -->
			<gd_npc npc_id="218857"/><!-- Rain Audria -->
			<gd_npc npc_id="218858"/><!-- Foliage Audria -->
			<gd_npc npc_id="218859"/><!-- Sunset Audria -->
			<gd_npc npc_id="218860"/><!-- Ice Audria -->
			<gd_npc npc_id="218861"/><!-- Snowflower Audria -->
		</gd_npcs>
		<gd_items>
			<gd_item id="182006981"/><!-- Divine Fertile Soil -->
		</gd_items>
	</gd_rule>
	<!-- Single Monster Drops -->
	<gd_rule rule_name="Named Season Crystal" chance="100" member_limit="6">
		<gd_maps>
			<gd_map map_id="700010000"/><!-- Oriel -->
		</gd_maps>
		<gd_npcs>
			<gd_npc npc_id="218850"/><!-- Spring Agrint -->
		</gd_npcs>
		<gd_items>
			<gd_item id="182006839" max_count="3"/><!-- Spring Crystal -->
		</gd_items>
	</gd_rule>
	<gd_rule rule_name="Named Season Crystal" chance="100" member_limit="6">
		<gd_maps>
			<gd_map map_id="700010000"/><!-- Oriel -->
		</gd_maps>
		<gd_npcs>
			<gd_npc npc_id="218851"/><!-- Summer Agrint -->
		</gd_npcs>
		<gd_items>
			<gd_item id="182006840" max_count="3"/><!-- Summer Crystal -->
		</gd_items>
	</gd_rule>
	<gd_rule rule_name="Named Season Crystal" chance="100" member_limit="6">
		<gd_maps>
			<gd_map map_id="700010000"/><!-- Oriel -->
		</gd_maps>
		<gd_npcs>
			<gd_npc npc_id="218852"/><!-- Autumn Agrint -->
		</gd_npcs>
		<gd_items>
			<gd_item id="182006841" max_count="3"/><!-- Fall Crystal -->
		</gd_items>
	</gd_rule>
	<gd_rule rule_name="Named Season Crystal" chance="100" member_limit="6">
		<gd_maps>
			<gd_map map_id="700010000"/><!-- Oriel -->
		</gd_maps>
		<gd_npcs>
			<gd_npc npc_id="218853"/><!-- Winter Agrint -->
		</gd_npcs>
		<gd_items>
			<gd_item id="182006842" max_count="3"/><!-- Winter Crystal -->
		</gd_items>
	</gd_rule>
	<gd_rule rule_name="Named Season Leaf" chance="100" member_limit="6">
		<gd_maps>
			<gd_map map_id="700010000"/><!-- Oriel -->
		</gd_maps>
		<gd_npcs>
			<gd_npc npc_id="218850"/><!-- Spring Agrint -->
		</gd_npcs>
		<gd_items>
			<gd_item id="182006843"/><!-- Spring Leaf -->
		</gd_items>
	</gd_rule>
	<gd_rule rule_name="Named Season Leaf" chance="100" member_limit="6">
		<gd_maps>
			<gd_map map_id="700010000"/><!-- Oriel -->
		</gd_maps>
		<gd_npcs>
			<gd_npc npc_id="218851"/><!-- Summer Agrint -->
		</gd_npcs>
		<gd_items>
			<gd_item id="182006844"/><!-- Summer Leaf -->
		</gd_items>
	</gd_rule>
	<gd_rule rule_name="Named Season Leaf" chance="100" member_limit="6">
		<gd_maps>
			<gd_map map_id="700010000"/><!-- Oriel -->
		</gd_maps>
		<gd_npcs>
			<gd_npc npc_id="218852"/><!-- Autumn Agrint -->
		</gd_npcs>
		<gd_items>
			<gd_item id="182006845"/><!-- Autumn Leaf -->
		</gd_items>
	</gd_rule>
	<gd_rule rule_name="Named Season Leaf" chance="100" member_limit="6">
		<gd_maps>
			<gd_map map_id="700010000"/><!-- Oriel -->
		</gd_maps>
		<gd_npcs>
			<gd_npc npc_id="218853"/><!-- Winter Agrint -->
		</gd_npcs>
		<gd_items>
			<gd_item id="182006846"/><!-- Winter Leaf -->
		</gd_items>
	</gd_rule>
</global_rules>