<?xml version="1.0" encoding="utf-8"?>
<global_rules xmlns:xsi="http://www.w3.org/2001/XMLSchema-instance" xsi:noNamespaceSchemaLocation="../../global_rules.xsd">
	<gd_rule rule_name="Name Box" chance="100" member_limit="100">
		<gd_maps>
			<gd_map map_id="400030000" /><!-- Transidium_Annex -->
		</gd_maps>
		<gd_npcs>
			<gd_npc npc_id="277224" /><!-- Ahserion -->
		</gd_npcs>
		<gd_items>
			<gd_item id="188053117" /><!-- Ahserion's Glory Reward Box -->
		</gd_items>
	</gd_rule>
</global_rules>