<?xml version="1.0" encoding="utf-8"?>
<global_rules xmlns:xsi="http://www.w3.org/2001/XMLSchema-instance" xsi:noNamespaceSchemaLocation="../../global_rules.xsd">
	<!-- Single Monster Drops -->
	<gd_rule rule_name="Named Mark" chance="100" member_limit="6">
		<gd_maps>
			<gd_map map_id="301230000" /><!-- Illuminary_Obelisk -->
		</gd_maps>
		<gd_npcs>
			<gd_npc npc_id="233740" /><!-- Test Weapon Dynatoum -->
		</gd_npcs>
		<gd_items>
			<gd_item id="186000238" min_count="60" max_count="90" /><!-- Conqueror's Mark -->
		</gd_items>
	</gd_rule>
	<gd_rule rule_name="Named Idian Pouch" chance="100">
		<gd_maps>
			<gd_map map_id="301230000" /><!-- Illuminary_Obelisk -->
		</gd_maps>
		<gd_npcs>
			<gd_npc npc_id="233740" /><!-- Test Weapon Dynatoum -->
		</gd_npcs>
		<gd_items>
			<gd_item id="188052825" /><!-- Illuminary Obelisk Idian Pouch -->
		</gd_items>
	</gd_rule>
	<gd_rule rule_name="Named Supply Chest" chance="100" member_limit="6">
		<gd_maps>
			<gd_map map_id="301230000" /><!-- Illuminary_Obelisk -->
		</gd_maps>
		<gd_npcs>
			<gd_npc npc_id="233740" /><!-- Test Weapon Dynatoum -->
		</gd_npcs>
		<gd_items>
			<gd_item id="188052823" /><!-- Illuminary Obelisk Supply Chest -->
		</gd_items>
	</gd_rule>
	<gd_rule rule_name="Named Equipment Chest" chance="100" member_limit="6">
		<gd_maps>
			<gd_map map_id="301230000" /><!-- Illuminary_Obelisk -->
		</gd_maps>
		<gd_npcs>
			<gd_npc npc_id="233740" /><!-- Test Weapon Dynatoum -->
		</gd_npcs>
		<gd_items>
			<gd_item id="188052827" /><!-- Dynatoum's Equipment Chest -->
		</gd_items>
	</gd_rule>
	<gd_rule rule_name="Named Enhancement Chest" chance="40">
		<gd_maps>
			<gd_map map_id="301230000" /><!-- Illuminary_Obelisk -->
		</gd_maps>
		<gd_npcs>
			<gd_npc npc_id="233740" /><!-- Test Weapon Dynatoum -->
		</gd_npcs>
		<gd_items>
			<gd_item id="188052824" /><!-- Illuminary Obelisk Enhancement Box -->
		</gd_items>
	</gd_rule>
	<gd_rule rule_name="Named Wings" chance="20">
		<gd_maps>
			<gd_map map_id="301230000" /><!-- Illuminary_Obelisk -->
		</gd_maps>
		<gd_npcs>
			<gd_npc npc_id="233740" /><!-- Test Weapon Dynatoum -->
		</gd_npcs>
		<gd_items>
			<gd_item id="187000129" chance="30" /><!-- Brazen Bulwark Burster -->
			<gd_item id="187000130" chance="70" /><!-- Bulwark Burster -->
		</gd_items>
	</gd_rule>
</global_rules>