<?xml version="1.0" encoding="utf-8"?>
<global_rules xmlns:xsi="http://www.w3.org/2001/XMLSchema-instance" xsi:noNamespaceSchemaLocation="../../global_rules.xsd">
	<!-- Single Monster Drops -->
	<gd_rule rule_name="Named Armor (Epic)" chance="75">
		<gd_maps>
			<gd_map map_id="300520000" /><!-- Dragon_Lords_Refuge -->
		</gd_maps>
		<gd_npcs>
			<gd_npc npc_id="219359" /><!-- Calindi Flamelord -->
		</gd_npcs>
		<gd_items>
			<gd_item id="110101459" /><!-- Tiamat Guard's Tunic -->
			<gd_item id="113101334" /><!-- Tiamat Guard's Leggings -->
			<gd_item id="112101274" /><!-- Tiamat Guard's Pauldrons -->
			<gd_item id="111101317" /><!-- Tiamat Guard's Gloves -->
			<gd_item id="114101363" /><!-- Tiamat Guard's Shoes -->
			<gd_item id="110301369" /><!-- Tiamat Guard's Jerkin -->
			<gd_item id="113301336" /><!-- Tiamat Guard's Breeches -->
			<gd_item id="112301255" /><!-- Tiamat Guard's Shoulderguards -->
			<gd_item id="111301312" /><!-- Tiamat Guard's Vambrace -->
			<gd_item id="114301369" /><!-- Tiamat Guard's Boots -->
			<gd_item id="110501344" /><!-- Tiamat Guard's Hauberk -->
			<gd_item id="113501319" /><!-- Tiamat Guard's Chausses -->
			<gd_item id="112501244" /><!-- Tiamat Guard's Spaulders -->
			<gd_item id="111501304" /><!-- Tiamat Guard's Handguards -->
			<gd_item id="114501325" /><!-- Tiamat Guard's Brogans -->
			<gd_item id="110601317" /><!-- Tiamat Guard's Breastplate -->
			<gd_item id="113601271" /><!-- Tiamat Guard's Greaves -->
			<gd_item id="112601262" /><!-- Tiamat Guard's Shoulderplates -->
			<gd_item id="111601282" /><!-- Tiamat Guard's Gauntlets -->
			<gd_item id="114601266" /><!-- Tiamat Guard's Sabatons -->
		</gd_items>
	</gd_rule>
	<gd_rule rule_name="Named Supplements" chance="60">
		<gd_maps>
			<gd_map map_id="300520000" /><!-- Dragon_Lords_Refuge -->
		</gd_maps>
		<gd_npcs>
			<gd_npc npc_id="219359" /><!-- Calindi Flamelord -->
		</gd_npcs>
		<gd_items>
			<gd_item id="166100011" min_count="10" max_count="20" /><!-- Greater Supplements (Mythic) -->
		</gd_items>
	</gd_rule>
</global_rules>