<?xml version="1.0" encoding="utf-8"?>
<global_rules xmlns:xsi="http://www.w3.org/2001/XMLSchema-instance" xsi:noNamespaceSchemaLocation="../../global_rules.xsd">
	<!-- Single Monster Drops -->
	<gd_rule rule_name="Named Key" chance="75">
		<gd_maps>
			<gd_map map_id="300050000" /><!-- Asteria_Chamber -->
		</gd_maps>
		<gd_npcs>
			<gd_npc npc_id="214762" /><!-- Dakaer Chanter -->
		</gd_npcs>
		<gd_items>
			<gd_item id="185000033" /><!-- Golden Abyss Key -->
		</gd_items>
	</gd_rule>
	<gd_rule rule_name="Named Key" chance="90">
		<gd_maps>
			<gd_map map_id="300050000" /><!-- Asteria_Chamber -->
		</gd_maps>
		<gd_npcs>
			<gd_npc npc_id="214766" /><!-- Dakaer Tactician -->
		</gd_npcs>
		<gd_items>
			<gd_item id="185000034" /><!-- Jeweled Abyss Key -->
		</gd_items>
	</gd_rule>
	<gd_rule rule_name="Named Key" chance="100">
		<gd_maps>
			<gd_map map_id="300050000" /><!-- Asteria_Chamber -->
		</gd_maps>
		<gd_npcs>
			<gd_npc npc_id="215444" /><!-- Ebonlord Kiriel -->
		</gd_npcs>
		<gd_items>
			<gd_item id="185000035" /><!-- Magic Abyss Key -->
		</gd_items>
	</gd_rule>
</global_rules>