<?xml version="1.0" encoding="utf-8"?>
<global_rules xmlns:xsi="http://www.w3.org/2001/XMLSchema-instance" xsi:noNamespaceSchemaLocation="../../global_rules.xsd">
	<gd_rule rule_name="Named First Key" chance="100">
		<gd_maps>
			<gd_map map_id="320120000" /><!-- Shadow_Court_Dungeon -->
		</gd_maps>
		<gd_npcs>
			<gd_npc npc_id="214347" /><!-- Unfest Guard Captain -->
		</gd_npcs>
		<gd_items>
			<gd_item id="185000014" /><!-- Arena Basement Level 3 Key 1 -->
		</gd_items>
	</gd_rule>
	<gd_rule rule_name="Named Second Key" chance="100">
		<gd_maps>
			<gd_map map_id="320120000" /><!-- Shadow_Court_Dungeon -->
		</gd_maps>
		<gd_npcs>
			<gd_npc npc_id="214349" /><!-- Dyspeptic Karnif -->
		</gd_npcs>
		<gd_items>
			<gd_item id="185000011" /><!-- Arena Basement Level 2 Key 1 -->
		</gd_items>
	</gd_rule>
	<gd_rule rule_name="Named Third Key" chance="100">
		<gd_maps>
			<gd_map map_id="320120000" /><!-- Shadow_Court_Dungeon -->
		</gd_maps>
		<gd_npcs>
			<gd_npc npc_id="214351" /><!-- Dyspepsic Karnif -->
		</gd_npcs>
		<gd_items>
			<gd_item id="185000012" /><!-- Arena Basement Level 2 Key 2 -->
		</gd_items>
	</gd_rule>
	<gd_rule rule_name="Named Fourth Key" chance="100">
		<gd_maps>
			<gd_map map_id="320120000" /><!-- Shadow_Court_Dungeon -->
		</gd_maps>
		<gd_npcs>
			<gd_npc npc_id="214353" /><!-- Bejeweled Mosbear -->
		</gd_npcs>
		<gd_items>
			<gd_item id="185000013" /><!-- Arena Basement Level 2 Key 3 -->
		</gd_items>
	</gd_rule>
	<gd_rule rule_name="Named Fifth Key" chance="100">
		<gd_maps>
			<gd_map map_id="320120000" /><!-- Shadow_Court_Dungeon -->
		</gd_maps>
		<gd_npcs>
			<gd_npc npc_id="214530" /><!-- Prison Guard -->
		</gd_npcs>
		<gd_items>
			<gd_item id="185000008" /><!-- Arena Basement Level 1 Key 1 -->
		</gd_items>
	</gd_rule>
	<gd_rule rule_name="Named Sixth Key" chance="100">
		<gd_maps>
			<gd_map map_id="320120000" /><!-- Shadow_Court_Dungeon -->
		</gd_maps>
		<gd_npcs>
			<gd_npc npc_id="214356" /><!-- Sorcerer Wraith -->
		</gd_npcs>
		<gd_items>
			<gd_item id="185000009" /><!-- Arena Basement Level 1 Key 2 -->
		</gd_items>
	</gd_rule>
	<gd_rule rule_name="Named Seventh Key" chance="100">
		<gd_maps>
			<gd_map map_id="320120000" /><!-- Shadow_Court_Dungeon -->
		</gd_maps>
		<gd_npcs>
			<gd_npc npc_id="214360" /><!-- Ranger Spirit -->
		</gd_npcs>
		<gd_items>
			<gd_item id="185000010" /><!-- Arena Basement Level 1 Key 3 -->
		</gd_items>
	</gd_rule>
</global_rules>