<?xml version="1.0" encoding="utf-8"?>
<global_rules xmlns:xsi="http://www.w3.org/2001/XMLSchema-instance" xsi:noNamespaceSchemaLocation="../../global_rules.xsd">
	<!-- Single Monster Drops -->
	<gd_rule rule_name="Named Weapon (Epic)" chance="33">
		<gd_maps>
			<gd_map map_id="320150000" /><!-- Padmarashkas_Cave -->
		</gd_maps>
		<gd_npcs>
			<gd_npc npc_id="216580" /><!-- Padmarashka -->
		</gd_npcs>
		<gd_items>
			<gd_item id="100000920" /><!-- Padmarashka's Sword -->
			<gd_item id="100100690" /><!-- Padmarashka's Warhammer -->
			<gd_item id="100200820" /><!-- Padmarashka's Dagger -->
			<gd_item id="101700735" /><!-- Padmarashka's Longbow -->
			<gd_item id="100500711" /><!-- Padmarashka's Jewel -->
			<gd_item id="100600768" /><!-- Padmarashka's Tome -->
			<gd_item id="100900697" /><!-- Padmarashka's Greatsword -->
			<gd_item id="101300667" /><!-- Padmarashka's Spear -->
			<gd_item id="101500712" /><!-- Padmarashka's Staff -->
			<gd_item id="101800639" /><!-- Padmarashka's Pistol -->
			<gd_item id="101900638" /><!-- Padmarashka's Aethercannon -->
			<gd_item id="102100569" /><!-- Padmarashka's Cipher-Blade -->
			<gd_item id="102000673" /><!-- Padmarashka's Harp -->
		</gd_items>
	</gd_rule>
	<gd_rule rule_name="Named Armor (Unique)" chance="100">
		<gd_maps>
			<gd_map map_id="320150000" /><!-- Padmarashkas_Cave -->
		</gd_maps>
		<gd_npcs>
			<gd_npc npc_id="216580" /><!-- Padmarashka -->
		</gd_npcs>
		<gd_items>
			<gd_item id="110101090" /><!-- Padmarashka's Tunic -->
			<gd_item id="110301039" /><!-- Padmarashka's Jerkin -->
			<gd_item id="110501007" /><!-- Padmarashka's Hauberk -->
			<gd_item id="110600987" /><!-- Padmarashka's Breastplate -->
		</gd_items>
	</gd_rule>
	<gd_rule rule_name="Named Armor (Unique)" chance="100">
		<gd_maps>
			<gd_map map_id="320150000" /><!-- Padmarashkas_Cave -->
		</gd_maps>
		<gd_npcs>
			<gd_npc npc_id="218756" /><!-- Padmarashka -->
		</gd_npcs>
		<gd_items>
			<gd_item id="110101090" /><!-- Padmarashka's Tunic -->
			<gd_item id="113100997" /><!-- Padmarashka's Leggings -->
			<gd_item id="112100941" /><!-- Padmarashka's Pauldrons -->
			<gd_item id="111100985" /><!-- Padmarashka's Gloves -->
			<gd_item id="114101026" /><!-- Padmarashka's Shoes -->
			<gd_item id="110301039" /><!-- Padmarashka's Jerkin -->
			<gd_item id="113301010" /><!-- Padmarashka's Breeches -->
			<gd_item id="112300939" /><!-- Padmarashka's Shoulderguards -->
			<gd_item id="111300990" /><!-- Padmarashka's Vambrace -->
			<gd_item id="114301046" /><!-- Padmarashka's Boots -->
			<gd_item id="110501007" /><!-- Padmarashka's Hauberk -->
			<gd_item id="113500980" /><!-- Padmarashka's Chausses -->
			<gd_item id="112500926" /><!-- Padmarashka's Spaulders -->
			<gd_item id="111500977" /><!-- Padmarashka's Handguards -->
			<gd_item id="114500989" /><!-- Padmarashka's Brogans -->
			<gd_item id="110600987" /><!-- Padmarashka's Breastplate -->
			<gd_item id="113600951" /><!-- Padmarashka's Greaves -->
			<gd_item id="112600941" /><!-- Padmarashka's Shoulderplates -->
			<gd_item id="111600968" /><!-- Padmarashka's Gauntlets -->
			<gd_item id="114600948" /><!-- Padmarashka's Sabatons -->
		</gd_items>
	</gd_rule>
	<gd_rule rule_name="Named Weapon (Epic)" chance="33">
		<gd_maps>
			<gd_map map_id="320150000" /><!-- Padmarashkas_Cave -->
		</gd_maps>
		<gd_npcs>
			<gd_npc npc_id="218756" /><!-- Padmarashka -->
		</gd_npcs>
		<gd_items>
			<gd_item id="100000920" /><!-- Padmarashka's Sword -->
			<gd_item id="100100690" /><!-- Padmarashka's Warhammer -->
			<gd_item id="100200820" /><!-- Padmarashka's Dagger -->
			<gd_item id="101700735" /><!-- Padmarashka's Longbow -->
			<gd_item id="100500711" /><!-- Padmarashka's Jewel -->
			<gd_item id="100600768" /><!-- Padmarashka's Tome -->
			<gd_item id="100900697" /><!-- Padmarashka's Greatsword -->
			<gd_item id="101300667" /><!-- Padmarashka's Spear -->
			<gd_item id="101500712" /><!-- Padmarashka's Staff -->
			<gd_item id="101800639" /><!-- Padmarashka's Pistol -->
			<gd_item id="101900638" /><!-- Padmarashka's Aethercannon -->
			<gd_item id="102100569" /><!-- Padmarashka's Cipher-Blade -->
			<gd_item id="102000673" /><!-- Padmarashka's Harp -->
		</gd_items>
	</gd_rule>
	<gd_rule rule_name="Named Shield (Epic)" chance="33">
		<gd_maps>
			<gd_map map_id="320150000" /><!-- Padmarashkas_Cave -->
		</gd_maps>
		<gd_npcs>
			<gd_npc npc_id="218756" /><!-- Padmarashka -->
		</gd_npcs>
		<gd_items>
			<gd_item id="115001332" /><!-- Padmarashka's Raging Scale Shield -->
			<gd_item id="115001017" /><!-- Padmarashka's Shield -->
			<gd_item id="115001325" /><!-- Padmarashka's Raging Shield -->
		</gd_items>
	</gd_rule>
	<gd_rule rule_name="Named Armor (Epic)" chance="33">
		<gd_maps>
			<gd_map map_id="320150000" /><!-- Padmarashkas_Cave -->
		</gd_maps>
		<gd_npcs>
			<gd_npc npc_id="218756" /><!-- Padmarashka -->
		</gd_npcs>
		<gd_items>
			<gd_item id="110101374" /><!-- Padmarashka's Raging Tunic -->
			<gd_item id="113101268" /><!-- Padmarashka's Raging Leggings -->
			<gd_item id="112101207" /><!-- Padmarashka's Raging Pauldrons -->
			<gd_item id="111101249" /><!-- Padmarashka's Raging Gloves -->
			<gd_item id="114101295" /><!-- Padmarashka's Raging Shoes -->
			<gd_item id="110301301" /><!-- Padmarashka's Raging Jerkin -->
			<gd_item id="113301270" /><!-- Padmarashka's Raging Breeches -->
			<gd_item id="112301190" /><!-- Padmarashka's Raging Shoulderguards -->
			<gd_item id="111301244" /><!-- Padmarashka's Raging Vambrace -->
			<gd_item id="114301301" /><!-- Padmarashka's Raging Boots -->
			<gd_item id="110301586" /><!-- Padmarashka's Magic Jerkin -->
			<gd_item id="113301552" /><!-- Padmarashka's Magic Breeches -->
			<gd_item id="112301465" /><!-- Padmarashka's Magic Shoulderguards -->
			<gd_item id="111301524" /><!-- Padmarashka's Magic Vambrace -->
			<gd_item id="114301590" /><!-- Padmarashka's Magic Boots -->
			<gd_item id="110501279" /><!-- Padmarashka's Raging Hauberk -->
			<gd_item id="113501255" /><!-- Padmarashka's Raging Chausses -->
			<gd_item id="112501183" /><!-- Padmarashka's Raging Spaulders -->
			<gd_item id="111501238" /><!-- Padmarashka's Raging Handguards -->
			<gd_item id="114501259" /><!-- Padmarashka's Raging Brogans -->
			<gd_item id="110551007" /><!-- Sensitive Padmarashka's Magic Hauberk -->
			<gd_item id="113501583" /><!-- Sensitive Padmarashka's Magic Chausses -->
			<gd_item id="112501507" /><!-- Sensitive Padmarashka's Magic Spaulders -->
			<gd_item id="111501565" /><!-- Sensitive Padmarashka's Magic Handguards -->
			<gd_item id="114501592" /><!-- Sensitive Padmarashka's Magic Brogans -->
			<gd_item id="110601252" /><!-- Padmarashka's Raging Breastplate -->
			<gd_item id="113601208" /><!-- Padmarashka's Raging Greaves -->
			<gd_item id="112601195" /><!-- Padmarashka's Raging Shoulderplates -->
			<gd_item id="111601217" /><!-- Padmarashka's Raging Gauntlets -->
			<gd_item id="114601201" /><!-- Padmarashka's Raging Sabatons -->
		</gd_items>
	</gd_rule>
</global_rules>