<?xml version="1.0" encoding="utf-8"?>
<global_rules xmlns:xsi="http://www.w3.org/2001/XMLSchema-instance" xsi:noNamespaceSchemaLocation="../../global_rules.xsd">
	<!-- Multiple Monster Drops -->
	<gd_rule rule_name="Named Key" chance="100">
		<gd_maps>
			<gd_map map_id="310050000" /><!-- Aetherogenetics_Lab -->
		</gd_maps>
		<gd_npcs>
			<gd_npc npc_id="212174" /><!-- Librarian Selima -->
			<gd_npc npc_id="212175" /><!-- Expert Lab Scholar -->
		</gd_npcs>
		<gd_items>
			<gd_item id="185000002" /><!-- Lepharist Research Center Key 2 -->
		</gd_items>
	</gd_rule>
	<!-- Single Monster Drops -->
	<gd_rule rule_name="Named Armor (Rare)" chance="70">
		<gd_maps>
			<gd_map map_id="310050000" /><!-- Aetherogenetics_Lab -->
		</gd_maps>
		<gd_npcs>
			<gd_npc npc_id="212174" /><!-- Librarian Selima -->
		</gd_npcs>
		<gd_items>
			<gd_item id="112100676" /><!-- Researcher's Pauldrons -->
			<gd_item id="112500664" /><!-- Researcher's Spaulders -->
			<gd_item id="114100745" /><!-- Researcher's Shoes -->
			<gd_item id="114300758" /><!-- Researcher's Boots -->
			<gd_item id="114500724" /><!-- Researcher's Brogans -->
			<gd_item id="114600684" /><!-- Researcher's Sabatons -->
		</gd_items>
	</gd_rule>
	<gd_rule rule_name="Named Armor (Rare)" chance="70">
		<gd_maps>
			<gd_map map_id="310050000" /><!-- Aetherogenetics_Lab -->
		</gd_maps>
		<gd_npcs>
			<gd_npc npc_id="212181" /><!-- Head Chef Pamsey -->
		</gd_npcs>
		<gd_items>
			<gd_item id="112300676" /><!-- Researcher's Shoulderguards -->
			<gd_item id="112600672" /><!-- Researcher's Shoulderplates -->
			<gd_item id="111100716" /><!-- Researcher's Gloves -->
			<gd_item id="111300718" /><!-- Researcher's Vambrace -->
			<gd_item id="111500705" /><!-- Researcher's Handguards -->
		</gd_items>
	</gd_rule>
	<gd_rule rule_name="Named Head (Rare)" chance="70">
		<gd_maps>
			<gd_map map_id="310050000" /><!-- Aetherogenetics_Lab -->
		</gd_maps>
		<gd_npcs>
			<gd_npc npc_id="212181" /><!-- Head Chef Pamsey -->
		</gd_npcs>
		<gd_items>
			<gd_item id="125001564" /><!-- Pamsey's Cooking Hat -->
		</gd_items>
	</gd_rule>
	<gd_rule rule_name="Named Key" chance="100">
		<gd_maps>
			<gd_map map_id="310050000" /><!-- Aetherogenetics_Lab -->
		</gd_maps>
		<gd_npcs>
			<gd_npc npc_id="212193" /><!-- Pretor Key Keeper -->
		</gd_npcs>
		<gd_items>
			<gd_item id="185000004" /><!-- Lepharist Research Center Key 4 -->
		</gd_items>
	</gd_rule>
	<gd_rule rule_name="Named Key" chance="100">
		<gd_maps>
			<gd_map map_id="310050000" /><!-- Aetherogenetics_Lab -->
		</gd_maps>
		<gd_npcs>
			<gd_npc npc_id="212196" /><!-- Hungry Mudthorn -->
		</gd_npcs>
		<gd_items>
			<gd_item id="185000003" /><!-- Lepharist Research Center Key 3 -->
		</gd_items>
	</gd_rule>
	<gd_rule rule_name="Named Weapon (Legend)" chance="30">
		<gd_maps>
			<gd_map map_id="310050000" /><!-- Aetherogenetics_Lab -->
		</gd_maps>
		<gd_npcs>
			<gd_npc npc_id="212211" /><!-- RM-78c -->
		</gd_npcs>
		<gd_items>
			<gd_item id="100000580" /><!-- Dominating Sword -->
			<gd_item id="100200554" /><!-- Dominating Dagger -->
			<gd_item id="100900439" /><!-- Dominating Greatsword -->
			<gd_item id="100500442" /><!-- Dominating Jewel -->
			<gd_item id="101700458" /><!-- Dominating Longbow -->
			<gd_item id="101300429" /><!-- Dominating Spear -->
			<gd_item id="101500444" /><!-- Dominating Staff -->
			<gd_item id="100600475" /><!-- Dominating Tome -->
			<gd_item id="100100445" /><!-- Dominating Warhammer -->
			<gd_item id="101900813" /><!-- Complete Subject's Aethercannon -->
			<gd_item id="101800809" /><!-- Complete Subject's Pistol -->
			<gd_item id="102100708" /><!-- Complete Subject's Cipher-Blade -->
			<gd_item id="102000847" /><!-- Complete Subject's Harp -->
		</gd_items>
	</gd_rule>
	<gd_rule rule_name="Named Armor (Rare)" chance="70">
		<gd_maps>
			<gd_map map_id="310050000" /><!-- Aetherogenetics_Lab -->
		</gd_maps>
		<gd_npcs>
			<gd_npc npc_id="212211" /><!-- RM-78c -->
		</gd_npcs>
		<gd_items>
			<gd_item id="113100725" /><!-- Researcher's Leggings -->
			<gd_item id="113300741" /><!-- Researcher's Breeches -->
			<gd_item id="113500715" /><!-- Researcher's Chausses -->
			<gd_item id="113600689" /><!-- Researcher's Greaves -->
			<gd_item id="110100802" /><!-- Researcher's Tunic -->
			<gd_item id="110300758" /><!-- Researcher's Jerkin -->
			<gd_item id="110500735" /><!-- Researcher's Hauberk -->
			<gd_item id="110600723" /><!-- Researcher's Breastplate -->
		</gd_items>
	</gd_rule>
	<gd_rule rule_name="Named Key" chance="100">
		<gd_maps>
			<gd_map map_id="310050000" /><!-- Aetherogenetics_Lab -->
		</gd_maps>
		<gd_npcs>
			<gd_npc npc_id="212341" /><!-- The Keykeeper -->
		</gd_npcs>
		<gd_items>
			<gd_item id="185000001" /><!-- Lepharist Research Center Key 1 -->
		</gd_items>
	</gd_rule>
	<gd_rule rule_name="Named Key" chance="100">
		<gd_maps>
			<gd_map map_id="310050000" /><!-- Aetherogenetics_Lab -->
		</gd_maps>
		<gd_npcs>
			<gd_npc npc_id="212342" /><!-- Key Eater -->
		</gd_npcs>
		<gd_items>
			<gd_item id="185000005" /><!-- Lepharist Research Center Key 5 -->
		</gd_items>
	</gd_rule>
</global_rules>